{
  "schema_version": 1,
  "asset_type": "rig",
  "id": "oasis_chef",
  "display_name": "Oasis Chef",
  "description": "Example cutout chef: two-bone arms and legs, IK on both legs and the right arm, PNG torso/head/hat with costume skins, and two poses.",
  "tags": ["chef", "character", "rig", "example"],
  "author": "OasisFx examples",
  "source_author": "OasisFx (procedural, tools/synth_example_rig_parts.gd)",
  "source_license": "CC0",
  "bones": [
    {
      "id": "hips",
      "position": [0, -48],
      "length": 8,
      "angle_degrees": -90
    },
    {
      "id": "chest",
      "parent": "hips",
      "position": [0, -4],
      "length": 34,
      "angle_degrees": -90
    },
    {
      "id": "head",
      "parent": "chest",
      "position": [0, -34],
      "length": 40,
      "angle_degrees": -90
    },
    {
      "id": "upper_arm_l",
      "parent": "chest",
      "position": [-15, -28],
      "length": 16
    },
    {
      "id": "forearm_l",
      "parent": "upper_arm_l",
      "position": [0, 16],
      "length": 15
    },
    {
      "id": "upper_arm_r",
      "parent": "chest",
      "position": [15, -28],
      "length": 16
    },
    {
      "id": "forearm_r",
      "parent": "upper_arm_r",
      "position": [0, 16],
      "length": 15
    },
    {
      "id": "thigh_l",
      "parent": "hips",
      "position": [-7, 2],
      "length": 22
    },
    {
      "id": "shin_l",
      "parent": "thigh_l",
      "position": [0, 22],
      "length": 22
    },
    {
      "id": "thigh_r",
      "parent": "hips",
      "position": [7, 2],
      "length": 22
    },
    {
      "id": "shin_r",
      "parent": "thigh_r",
      "position": [0, 22],
      "length": 22
    }
  ],
  "parts": [
    {
      "id": "shadow",
      "polygon": [[26, 0], [24.7, 2.2], [21, 4.1], [15.3, 5.7], [8, 6.7], [0, 7], [-8, 6.7], [-15.3, 5.7], [-21, 4.1], [-24.7, 2.2], [-26, 0], [-24.7, -2.2], [-21, -4.1], [-15.3, -5.7], [-8, -6.7], [0, -7], [8, -6.7], [15.3, -5.7], [21, -4.1], [24.7, -2.2]],
      "color": "#00000040",
      "z_index": 0
    },
    {
      "id": "thigh_l_shape",
      "bone": "thigh_l",
      "polygon": [[-5, -2], [5, -2], [4.5, 23], [-4.5, 23]],
      "color": "#5B4636",
      "z_index": 10
    },
    {
      "id": "shin_l_shape",
      "bone": "shin_l",
      "polygon": [[-4.5, -2], [4.5, -2], [4, 20], [-4, 20]],
      "color": "#5B4636",
      "z_index": 10
    },
    {
      "id": "shoe_l",
      "bone": "shin_l",
      "polygon": [[-5, 18], [6, 18], [9, 22], [9, 25], [-5, 25]],
      "color": "#3A2A22",
      "z_index": 11
    },
    {
      "id": "thigh_r_shape",
      "bone": "thigh_r",
      "polygon": [[-5, -2], [5, -2], [4.5, 23], [-4.5, 23]],
      "color": "#5B4636",
      "z_index": 10
    },
    {
      "id": "shin_r_shape",
      "bone": "shin_r",
      "polygon": [[-4.5, -2], [4.5, -2], [4, 20], [-4, 20]],
      "color": "#5B4636",
      "z_index": 10
    },
    {
      "id": "shoe_r",
      "bone": "shin_r",
      "polygon": [[-5, 18], [6, 18], [9, 22], [9, 25], [-5, 25]],
      "color": "#3A2A22",
      "z_index": 11
    },
    {
      "id": "upper_arm_l_shape",
      "bone": "upper_arm_l",
      "polygon": [[-4.5, -2], [4.5, -2], [4, 17], [-4, 17]],
      "color": "#E6DFD3",
      "z_index": 11
    },
    {
      "id": "forearm_l_shape",
      "bone": "forearm_l",
      "polygon": [[-4, -2], [4, -2], [3.5, 14], [-3.5, 14]],
      "color": "#E6DFD3",
      "z_index": 11
    },
    {
      "id": "hand_l",
      "bone": "forearm_l",
      "polygon": [[4.5, 16], [3.9, 18.2], [2.3, 19.9], [0, 20.5], [-2.2, 19.9], [-3.9, 18.2], [-4.5, 16], [-3.9, 13.8], [-2.3, 12.1], [0, 11.5], [2.3, 12.1], [3.9, 13.7]],
      "color": "#F2C9A0",
      "z_index": 11
    },
    {
      "id": "torso",
      "bone": "chest",
      "kind": "sprite",
      "texture": "res://addons/oasis_fx/presets/examples/rig_parts/torso.png",
      "position": [0, -17],
      "z_index": 12
    },
    {
      "id": "face",
      "bone": "head",
      "kind": "sprite",
      "texture": "res://addons/oasis_fx/presets/examples/rig_parts/head.png",
      "position": [0, -17],
      "z_index": 14
    },
    {
      "id": "hat",
      "bone": "head",
      "kind": "sprite",
      "texture": "res://addons/oasis_fx/presets/examples/rig_parts/hat_chef.png",
      "position": [0, -40],
      "z_index": 15
    },
    {
      "id": "upper_arm_r_shape",
      "bone": "upper_arm_r",
      "polygon": [[-4.5, -2], [4.5, -2], [4, 17], [-4, 17]],
      "color": "#F4EFE6",
      "z_index": 16
    },
    {
      "id": "forearm_r_shape",
      "bone": "forearm_r",
      "polygon": [[-4, -2], [4, -2], [3.5, 14], [-3.5, 14]],
      "color": "#F4EFE6",
      "z_index": 16
    },
    {
      "id": "ladle",
      "bone": "forearm_r",
      "polygon": [[-1.5, 10], [1.5, 10], [1.5, 38], [-1.5, 38]],
      "color": "#8A5A3C",
      "z_index": 15
    },
    {
      "id": "ladle_bowl",
      "bone": "forearm_r",
      "polygon": [[7, 42], [6.3, 44.6], [4.4, 46.7], [1.6, 47.8], [-1.6, 47.8], [-4.4, 46.7], [-6.3, 44.6], [-7, 42], [-6.3, 39.4], [-4.4, 37.3], [-1.6, 36.2], [1.6, 36.2], [4.4, 37.3], [6.3, 39.4]],
      "color": "#9AA6B2",
      "z_index": 15
    },
    {
      "id": "hand_r",
      "bone": "forearm_r",
      "polygon": [[4.5, 16], [3.9, 18.2], [2.3, 19.9], [0, 20.5], [-2.2, 19.9], [-3.9, 18.2], [-4.5, 16], [-3.9, 13.8], [-2.3, 12.1], [0, 11.5], [2.3, 12.1], [3.9, 13.7]],
      "color": "#F2C9A0",
      "z_index": 17
    }
  ],
  "markers": [
    {
      "id": "ladle_tip",
      "bone": "forearm_r",
      "position": [0, 46]
    },
    {
      "id": "above_head",
      "bone": "head",
      "position": [0, -62]
    }
  ],
  "ik_chains": [
    {
      "id": "leg_l",
      "upper": "thigh_l",
      "lower": "shin_l"
    },
    {
      "id": "leg_r",
      "upper": "thigh_r",
      "lower": "shin_r",
      "flip_bend": true
    },
    {
      "id": "arm_r",
      "upper": "upper_arm_r",
      "lower": "forearm_r"
    }
  ],
  "skins": [
    {
      "name": "night_shift",
      "parts": [
        {
          "part": "torso",
          "texture": "res://addons/oasis_fx/presets/examples/rig_parts/torso_night.png"
        },
        {
          "part": "upper_arm_l_shape",
          "color": "#26304F"
        },
        {
          "part": "forearm_l_shape",
          "color": "#26304F"
        },
        {
          "part": "upper_arm_r_shape",
          "color": "#2F3B63"
        },
        {
          "part": "forearm_r_shape",
          "color": "#2F3B63"
        }
      ]
    },
    {
      "name": "beret",
      "parts": [
        {
          "part": "hat",
          "texture": "res://addons/oasis_fx/presets/examples/rig_parts/hat_beret.png"
        }
      ]
    },
    {
      "name": "no_hat",
      "parts": [
        {
          "part": "hat",
          "visible": "hide"
        }
      ]
    }
  ],
  "poses": [
    {
      "name": "wave",
      "bones": [
        {
          "bone": "upper_arm_l",
          "rotation_degrees": 150
        },
        {
          "bone": "forearm_l",
          "rotation_degrees": -30
        },
        {
          "bone": "head",
          "rotation_degrees": -6
        }
      ]
    },
    {
      "name": "crouch",
      "bones": [
        {
          "bone": "hips",
          "rotation_degrees": 0,
          "position": [0, -38]
        },
        {
          "bone": "chest",
          "rotation_degrees": 12
        }
      ]
    }
  ]
}
